{
  "$schema": "https://openpresentation.org/schema/opf-color-scheme/v1",
  "id": "cool-horizon",
  "name": "Cool Horizon",
  "accent1": "#2874A6",
  "accent2": "#1B4F72",
  "accent3": "#5499C7",
  "accent4": "#7BDBB2",
  "accent5": "#3AC67A",
  "accent6": "#24A89E",
  "dark1": "#000000",
  "dark2": "#011842",
  "followedHyperlink": "#551A8B",
  "hyperlink": "#0000EE",
  "light1": "#FFFFFF",
  "light2": "#F0F0F0"
}
